{"$schema":"https://json-schema.org/draft/2020-12/schema","$id":"https://ibloud.github.io/ren-rhapsody/schemas/ledger-parameter.schema.json","title":"The Ledger Economic Parameter","type":"object","required":["parameter_id","value","unit","game_geography","source_geography","period","source","confidence","status","method"],"properties":{"parameter_id":{"type":"string"},"value":{"type":"number"},"unit":{"type":"string"},"game_geography":{"type":"string"},"source_geography":{"type":"string"},"period":{"type":"string"},"source":{"type":"object","required":["type","title","url","retrieved_at"],"properties":{"type":{"type":"string"},"title":{"type":"string"},"url":{"type":"string","format":"uri"},"retrieved_at":{"type":"string","format":"date"}},"additionalProperties":false},"confidence":{"enum":["A","B","C","D"]},"status":{"enum":["verified","provisional","stale","superseded","fictional"]},"method":{"type":"string"},"assumptions":{"type":"array","items":{"type":"string"}},"transformation":{"type":"string"}},"additionalProperties":false}