[
{"parameter_id":"operating_cost.mileage_proxy","value":0.76,"unit":"USD/mile","game_geography":"fictional-city","source_geography":"United States","period":"2026-H2","source":{"type":"government","title":"IRS Standard Mileage Rates","url":"https://www.irs.gov/tax-professionals/standard-mileage-rates","retrieved_at":"2026-09-23"},"confidence":"A","status":"provisional","method":"calibration_reference","assumptions":["Mileage rate is a cost proxy, not a claim about actual cash expense.","Fictional trip economics are derived from this reference."]},
{"parameter_id":"fuel.price_regular","value":4.478,"unit":"USD/gallon","game_geography":"fictional-city","source_geography":"United States","period":"2026-09-21-week","source":{"type":"government","title":"U.S. Energy Information Administration gasoline prices","url":"https://www.eia.gov/petroleum/gasdiesel/","retrieved_at":"2026-09-23"},"confidence":"A","status":"provisional","method":"calibration_reference","assumptions":["National average is a calibration input, not a fictional-city pump price."]}
]